{
  "schema": "walletwall.zk-adapter-evidence-response.v1",
  "service": "walletwall-zk-adapter-evidence-demo",
  "mode": "spike-non-production",
  "status": 200,
  "ok": true,
  "contentType": "application/json",
  "servedAt": "2026-01-01T00:00:00.000Z",
  "etag": "0x98fb94cfd69a4c962501f10a581656437d11edd5419426c019a0bcdd628d4375",
  "adapter": {
    "schema": "walletwall.zk-verifier-adapter.v1"
  },
  "limitations": [
    "Scaffold offline shape fixture — not a proof, not production ZK verification, not on-chain ML-DSA verification.",
    "Research prototype — not audited; testnet/local only; no real funds."
  ],
  "regeneration": {
    "command": "npm run zk:adapter:response",
    "deterministic": true
  }
}
